url,article_text
https://apnews.com/article/china-soft-power-rise-c6aede1c6eb66a776a7ae3b5477e2661,"The ‘becoming Chinese’ meme shows China’s soft power moment is here
The ‘becoming Chinese’ meme shows China’s soft power moment is here
BANGKOK (AP) — Have you “become Chinese”?
In recent months, 20-somethings around the world have taken over social media with posts enthusing about how they’re embracing Chinese ways of life. Videos proclaiming users are “Chinamaxxing,” or “in a very Chinese time of their lives” — namely by drinking hot water with boiled goji berries, eating dumplings or wearing slippers in the house, or flying to China and gushing about its modern infrastructure — are racking up millions of views.
Along with its economic and geopolitical rise, China’s government has tried for years to push its soft power on the global stage. But those official efforts never came close to the success the “becoming Chinese” meme is enjoying now.
Even senior Chinese diplomats have noted the trend. Xie Feng, the Chinese ambassador to the U.S., referenced the internet craze recently as he promoted a new visa-free transit policy and urged more Americans to “experience for yourselves a real, dynamic and panoramic China.”
The TikTok trend is the latest example of how Chinese products and consumables are enjoying a cultural cachet they’ve never had before globally. From movies to music, Labubu toys and even ordinary habits like drinking hot water, Chinese things are now seen by many as cool.
“China is gaining real soft power, and you can see it most clearly in how Chinese culture and ‘Chineseness’ are becoming familiar, repeatable, and globally consumable in everyday life,” said Shaoyu Yuan, a professor at the New York University School of Professional Studies’ Center for Global Affairs.
“That legitimacy,” Yuan said, “is earned through taste, utility, and entertainment.”
That soft power rise is enabled by China’s development in many industries: From manufacturing, where it holds a record $1.2 trillion trade surplus with the rest of the world, to social media, where it developed the addictive algorithms that made TikTok, to its own consumer culture, where homegrown names compete head to head with global brands.
Mixed feelings among Chinese Americans
Sherry Zhu, a 23-year-old from New Jersey, posted a couple of videos last year joking about how if you liked noodles and hotpot and wore slippers at home you were Chinese. One of her videos was shared almost a million times in December, and other TikTokers quickly caught on with the “becoming Chinese” meme.
But the trend has also raised thornier questions. For many Chinese people who have long faced discrimination in the West, the internet’s fascination with Chinese culture seems to be the latest form of cultural appropriation.
“Appreciation does not erase the racism that many Chinese people grew up with,” said Elise Zeng, 28, from Brooklyn, New York. A video she posted critiquing the social media phenomenon was liked by more than 36,000 people.
She recalls how during the COVID-19 pandemic she was afraid for her parents stepping out of the house because they heard about people getting attacked just walking down the street. At the time, many Asians reported being assaulted or verbally abused by people who blamed East Asians for the spread of the virus.
“Those experiences don’t just disappear because Chinese culture is suddenly cool and trendy,” she said.
Zhu acknowledged that she, too, has experienced bullying based on her identity, but said she was proud of her Chinese heritage. “I believe that visibility and cultural sharing can reduce misunderstanding over time,” she said.
China’s success in soft power has been building
The meme is riding on a broader embrace of Chinese popular culture that’s been building globally.
The frenzy over Labubus, the fuzzy ugly-cute dolls carried by the likes of Rihanna and other top celebrities, reached a peak last spring and summer, bringing a 300% rise in annual profit for Chinese parent company PopMart.
Several other cultural exports with more distinctly Chinese attributes have also found global success. On TikTok, the Chinese rapper known as Skaii isyourgod or “Lanlao” has gained fans around the world — even though he raps in Cantonese and with a thick regional accent, which many people in China wouldn’t understand either.
But that didn’t matter. Skaii isyourgod’s single “Blueprint Supreme” went viral last summer in China and abroad, amassing billions of views on TikTok globally.
Last year “Ne Zha 2,” the animated blockbuster about a young god from a popular Chinese children’s tale, became the highest grossing animated film of all time even before its release in North America.
Another success, the big budget video game “Black Myth: Wukong,” was similarly based on a story familiar to many Chinese kids about an adventurous monkey hero. The game broke the record for most-played single-player game on Steam when 2.4 million people played it simultaneously after its release.
More recently, Chinese digital maps like Amap have gone viral on social media over standard ones like Apple or Google for their level of detail, such as the ability to inform users if they will be in the shade versus the sun.
Soft power goes beyond official narratives
Xi has long pushed for his government to promote Chinese soft power abroad, calling on officials to “tell China’s story well” since 2013.
They have attempted to do so with ambitious projects like the multibillion-dollar Belt and Road initiative — a plan to build Chinese-funded infrastructure across the world — and investing in hundreds of Confucius Institutes.
But many Confucius Institutes, meant to be Beijing-funded centers teaching Chinese language and culture, have shut down in the West over concerns they were fronts for spying and propaganda, while the Belt and Road Initiative has been criticized as a debt trap by Western countries.
China’s ascending hard power has been well documented. It is the dominant manufacturer in the green energy sector, most visibly with its electric vehicles, but also across solar energy. It has the world’s second-largest military, behind the U.S. It is a manufacturing powerhouse, and its exports have swept the world.
Soft power, in contrast, is harder to quantify — or manufacture. China’s government has been eager to capitalize on the latest social media trend and throw state support behind cultural moments after they’ve broken out.
Global Times, a state-owned tabloid, claimed that the popularity of the “becoming Chinese” meme is linked to the success of “China’s social development.”
But the more officials vocally claim such successes and frame them as part of the “China story,” the more it may be received with skepticism, said Yuan, the professor.
“Cultural influence travels farther when it is chosen rather than announced,” he said."
https://apnews.com/article/shanghai-china-tesla-robots-electric-cars-musk-a05b41ae0d32fa391eaae1512871670a,"Tesla leader believes Shanghai factory operations will play a role in robot mass production
Tesla leader believes Shanghai factory operations will play a role in robot mass production
SHANGHAI (AP) — A Tesla Inc. leader said Tuesday he believes its Shanghai factory operations will help resolve the challenges in achieving mass production of the company’s humanoid robots as the U.S. electric vehicle giant pivots to robotics.
Wang Hao, Tesla’s vice president, said the Shanghai facilities, like other Tesla factories, will contribute after the company enters an era of robots.
Wang, who also serves as president of Tesla China, told reporters on a government-organized tour of one of its Shanghai factories that CEO Elon Musk once noted having production at scale is a critical challenge in manufacturing humanoid robots.
Wang said he believes the Shanghai manufacturing arm “is a golden key to solving this challenge,” but did not specify how the operation will support the company’s robotic business.
Musk has urged investors to focus less on car sales and more on what he considers a bright artificial intelligence future of robotaxis ferrying millions in cars without drivers, or even steering wheels, and robots watering plants and taking care of elderly parents.
Musk earlier underlined that shift by announcing Tesla had decided to end production of two older car models, S and X, in the second quarter and convert a Fremont, California, factory to instead produce its Optimus robots.
London-based technology research and advisory group Omdia said Tesla shipped fewer than 500 general-purpose embodied, intelligent robots in 2025. Still, the company is among the vendors that showcased industry-leading advancements in AI capabilities, its report said.
Tesla entered the mainland Chinese market in 2013 and the factory Wang spoke at delivered the company’s first made-in-China vehicles in late 2019. The factory delivered 851,000 electric vehicles in 2025, accounting for more than half of Tesla’s total global deliveries that year.
A separate factory began production in Shanghai in 2025, marking the firm’s launch of commercial energy storage manufacturing in China.
___
Leung reported from Hong Kong. Video producer Olivia Zhang contributed to this report."
https://www.cnbc.com/2026/04/20/stocks-making-the-biggest-moves-premarket-aal-mrvl-mstr.html,"Check out the companies making the biggest moves premarket: Airlines — The group was under pressure Monday as investors worry that renewed U.S.-Iran tensions will keep energy prices elevated and push consumers to travel less. American Airlines , Delta Air Lines and United Airlines were all down more than 2% before the bell. JetBlue Airways shed 1.2%. Marvell Technology , Broadcom — Shares jumped more than 7% after a report by The Information said the company is in talks with Google to build two new AI chips. Broadcom, which recently agreed to produce future versions of Google's AI chips, fell nearly 1.5% on the report. TopBuild — The installer and distributor of insulation materials jumped more than 17% after QXO announced it would acquire the company for $17 billion. In a release, QXO said said the acquisition will create a higher-margin business and it will be immediately accretive to the company's earnings. AST SpaceMobile — Shares fell 15% after a satellite launched over the weekend was placed into the wrong orbit. The company said in a release it expects the cost of the satellite to be recovered by an insurance policy, and it still plans to conduct orbital launches once every month to two months in 2026. Crypto-related stocks — The group fell after bitcoin prices declined more than 4% over the weekend, though they recovered some losses in Monday trading and were back above $75,000. Online trading platforms Robinhood and Coinbase fell more than 2%. Bitcoin treasury company Strategy declined nearly 2.5%. Energy stocks — A slew of names were lifted by rising oil prices as tensions between the U.S. and Iran heated up once again. APA , Coterra Energy and ConocoPhillips all rose by more than 2%. EOG Resources and Devon Energy were up more than 1.5%. Chevron and Exxon Mobil were in the green by 1%. Cruise lines — Concerns over fuel costs rising again and consumer demand weighed on these stocks on Monday. Carnival , Norwegian Cruise Line and Royal Caribbean Group all fell more than 2.5%. Newmont , Freeport-McMoRan — Prices of both precious and industrial metals fell, as investors saw the dollar strengthen on Monday and worried about economic growth amid higher oil prices again. Gold prices fell nearly 1.5%, sending gold miner Newmont down 2%. Copper prices also fell more than 1.5%, with Freeport-McMoRan declining 2% as well. Compass Pathways — The biotechnology company surged nearly 25% after President Donald Trump signed an executive order that directs his administration to speed up reviews of psychedelic drugs. Compass is conducting studies of psychedelics to create drugs for treatment-resistant depression and PTSD. — CNBC's Fred Imbert contributed reporting."
https://www.cnbc.com/2026/04/20/stocks-making-the-biggest-moves-midday-swk-aal-dow-mrvl.html,"Check out the companies making the biggest moves in midday trading: Stanley Black & Decker — The power toolmaker's shares jumped more than 4% after the company said recent changes to Section 232 tariffs aren't supposed to have a material impact on its full-year forecast . Section 232 tariffs set a general 50% rate on aluminum, steel and certain related products while some specific copper and derivative products are subject to a 25% rate, per the White House . Fermi — Shares of the energy infrastructure developer fell more than 22% following the resignation of CFO Miles Everson , just days after CEO Toby Neugebauer departed . Fermi was co-founded by former Energy Secretary Rick Perry to supply power to AI data center projects. Compass Pathways , AtaiBeckley — Shares of the psychedelic-focused drug developers were among several mostly smaller stocks surging in the wake of President Donald Trump's executive order to accelerate research and access to psychedelic medicines. AtaiBeckley stock jumped more than 25%, while Compass rose nearly 40%. Biogen — The biotech's stock rose nearly 3% after the company agreed to pay TJ Biopharma $850 million for the exclusive rights in China to sell felzartamab, an experimental treatment for immune-related diseases such as IgA nephropathy. The deal gives Biogen worldwide rights to develop and market the drug. Airlines — The group was under pressure Monday as investors worry that renewed U.S.-Iran tensions will keep energy prices elevated and push consumers to travel less. American Airlines ' stock tumbled nearly 5%, while United Airlines ' slipped more than 2%. Shares of JetBlue Airways and Delta Air Lines each shed about 1%. Fertilizer stocks — The persisting snarl in shipping traffic in the Strait of Hormuz drove trading of chemical and fertilizer stocks Monday. Shares of CF Industries rose nearly 2% after falling about 10% Friday. Shares of Dow and LyondellBasell Industries climbed about 4% and 2%, respectively, after falling double digits Friday. Marvell Technology , Broadcom — Marvell shares jumped more than 4% after a report by The Information said the company is in talks with Google to build two new AI chips. Broadcom, which recently agreed to produce future versions of Google's AI chips, saw its shares fall nearly 2% on the report. TopBuild — Shares of the installer and distributor of insulation materials jumped more than 16% after QXO announced it would acquire the company for $17 billion. In a release, QXO said the acquisition will create a higher-margin business and it will immediately add to its earnings. Still, QXO shares tumbled nearly 8% on the news of the deal. AST SpaceMobile — Shares fell 8% after a satellite launched over the weekend was placed into the wrong orbit. The company said in a release it expects the cost of the satellite to be recovered by an insurance policy, and it still plans to conduct orbital launches once every month to two months in 2026. Cruise lines — Concerns over fuel costs rising again and consumer demand weighed on these stocks on Monday. Carnival shares fell 1%, Norwegian Cruise Line shares tumbled nearly 5%, and Royal Caribbean Group shares slipped nearly 3%. — CNBC's Fred Imbert and Nick Wells contributed reporting."
https://www.cnbc.com/2026/04/23/risky-meme-trading-is-back-a-trading-rule-change-may-have-lit-the-fuse.html,"Retail traders are diving back into some of the market's most speculative corners, with a regulatory shift removing barriers to rapid-fire trading and helping revive the kind of meme-stock frenzy that has historically delivered sharp gains, and even sharper reversals.
April's rally in risk assets, fueled in part by an Iran ceasefire, has emboldened individual investors to pile back into volatile trades. In one of the more striking examples, retail traders stampeded into Allbirds after the troubled shoemaker slapped an artificial intelligence label on its business.
Shares surged to as high as $24 from roughly $2.50 after the company outlined plans to rebrand as NewBird AI and pivot toward compute infrastructure. Much of that advance has already unraveled, with the stock recently changing hands near $8 — a sharp reversal that underscores the volatility of such trades.
A similarly dramatic move led by smaller traders played out in Avis Budget Group. Shares of the company, ticker ""CAR,"" soared from under $100 last month to a record high near $850 in early trading Wednesday, before staging a sharp intraday U-turn lower, serving as another reminder of how quickly momentum-driven rallies can unwind.
Analysts at JPMorgan said crowding in so-called meme stocks has surged, approaching levels just shy of the extremes seen during the post-Liberation Day risk chase.
The Wall Street firm noted that a key catalyst may be a recent rule change by the U.S. Securities and Exchange Commission. Earlier this month, the regulator approved a proposal by FINRA to eliminate the so-called pattern day trader rule. Under the rule, traders who executed four or more day trades within five business days had to maintain a minimum equity of $25,000 in a margin account.
The new rule does away with the $25,000 requirement, replacing it with a more flexible ""intraday margin"" rule. FINRA called the old rule, hatched in the wake of the Dotcom crash ""outdated.""
""This change opens the door for more investors with smaller accounts to trade more actively, while still keeping protections in place through modern margin and risk controls,"" Adam Cohn, head of trading operations at TradeStation, told CNBC. ""Removing that barrier means more people can participate in short-term trading strategies ... We'll see a more open market with broader participation and more liquidity.""
JPMorgan analysts said the shift could drive a further pick-up in retail volumes in the coming months, reinforcing momentum in already crowded trades."
https://www.cnbc.com/2026/04/20/stocks-making-the-biggest-moves-after-hours-amzn-aapl-stld.html,"Check out the companies making headlines after the bell : Zions — Shares slipped almost 3% after the regional bank reported net interest income in its first quarter of $662 million, coming in below the $674.5 million analysts polled by StreetAccount had anticipated. However, Zions' earnings of $1.56 per share beat the consensus forecast of $1.42 per share, according to LSEG. Steel Dynamics — The steel producer added less than 1% after posting mixed first-quarter results. Revenue of $5.20 billion outpaced the $5.10 billion analysts surveyed by LSEG were expecting. However, Steel Dynamics reported earnings of $2.78 per share, a penny below the expected $2.79 per share. Shares had gained 4.5% earlier in the day. Amazon — The e-commerce giant popped 3% after the company agreed to invest up to $25 billion in Anthropic as part of an expanded agreement to build out AI infrastructure. This comes on top of the $8 billion Amazon has already invested in the artificial intelligence startup in recent years. In turn, Anthropic said in the Monday announcement that it's committed to spending more than $100 billion on Amazon Web Services technologies over the next 10 years. Apple — The tech stock fell less than 1% in extended trading after announcing that Tim Cook will step down as CEO on Sept. 1. Cook will assume the role of executive chairman and will be replaced by John Ternus, an insider who served as senior vice president of hardware engineering. Alaska Air Group — The airline's stock fell more than 1% after it pulled its 2026 forecast due to the uncertainty around fuel costs. In the first quarter, Alaska Air lost $1.68 per share, after adjustments, on revenue of $3.3 billion. Both numbers fell short of estimates. According to LSEG, analysts anticipated the airline would lose $1.35 per share on revenue of $3.31 billion. — CNBC's Christina Cheddar Berk contributed reporting. Correction: An earlier version of this story misstated which company had made a previous $8 billion investment in Anthropic. It was Amazon."
https://www.cnbc.com/2026/04/16/stocks-making-the-biggest-moves-premarket-.html,"Check out the companies making the biggest moves in premarket trading: PepsiCo — The snack and beverage giant posted first-quarter results that beat analyst expectations, sending the stock 1% higher. PepsiCo earned an adjusted $1.61 per share on revenue of $19.44 billion. Analysts polled by LSEG expected a profit of $1.55 per share on revenue of $18.94 billion. Taiwan Semiconductor Manufacturing — The chipmaker slipped 1.7% despite posting an earnings and revenue beat for its first quarter. PPG Industries — The paint and coating manufacturing company advanced 6% after announcing a global price increase of up to 20% across its portfolio. The company said that the price hike was already in progress. PPG cited volatility in the petrochemical, energy and transportation markets driving up costs in raw materials and packaging across its value chain as a catalyst for these price increases. Voyager Technologies — The space tech firm jumped 7% after NASA selected it for its seventh private astronaut mission to the International Space Station. The mission is expected to launch no earlier than 2028. SL Green Realty — Shares slipped 2% after the real estate investment trust reported first-quarter funds from operations of 84 cents per share, compared to $1.40 per share this time last year . Its net rental revenue of roughly $166 million exceeded the $144.5 million the firm reported in the first quarter of 2025, however. Travelers Companies — Shares fell 1.5% despite the company delivering an earnings and revenue beat in its first quarter report. The insurance company reported earnings of $7.71 per share and $11.92 billion in revenue, better than estimates of $7.07 in earnings per share and revenue of $10.72 billion, according to analysts polled by FactSet. J.B. Hunt Transport Services — The transportation stock rose 1% after the company reported first-quarter earnings of $1.49 per share, beating the $1.44 per share FactSet consensus estimate. J.B. Hunt's operating revenue of $3.06 billion also exceeded the expected $2.96 billion. Charles Schwab — The broker and financial services provider's first-quarter revenue of $6.48 billion fell short of the LSEG consensus estimate of %6.5 billion, sending shares 1% lower. Schwab's adjusted earnings, however, topped expectations. Flutter Entertainment — The parent of online gambling platform FanDuel dropped roughly 3% after being downgraded at Citi to sell from buy. The firm said it has less conviction in Flutter's growth prospects in the U.S. U.S. Bancorp — The regional bank lost 1%. U.S. Bancorp reported first-quarter earnings that beat analyst estimates but its net interest income and net interest margin fell short. The company's net interest income came in at $4.26 billion, versus the $4.27 billion expected from analysts polled by FactSet. — CNBC""s Lisa Kailai Han, Davis Giangiulio and Fred Imbert contributed reporting."
